full_name,email,phone,address
Младшев Антон Иванович,ivan@mail.ru,+79123456789,г. Москва ул. Ленина д. 15 кв. 42
,petr@mail.ru,+79223456789,г. Санкт-Петербург Невский пр. д. 100 кв. 5
,sidorov@mail.ru,+79333456789,г. Казань ул. Баумана д. 25 кв. 18
Кузнецова Мария,,+79444456789,г. Новосибирск ул. Красный пр. д. 50 кв. 77
Смирнов Дмитрий,invalid_email,+79555556789,г. Екатеринбург ул. Малышева д. 36 кв. 12
Попова Елена,popova@mail.ru,123,г. Нижний Новгород ул. Большая Покровская д. 22 кв. 8
Васильев Сергей,vasilev@mail.ru,+79777789012,